"TID","EN","FR","DE","ES","IT","NL","NO","PT","TR","JP","CN","KR","RU","AR","CNT"
"string","string","string","string","string","string","string","string","string","string","string","string","string","string","string","string"
"TID_EVENT_BOOST_SPELL_AND_HEROES","Happy Halloween! Boost your Spell Factories for ONE GEM each through Halloween weekend.","Joyeux Halloween ! Boostez vos usines de sorts pour UNE GEMME chacune pendant le week-end d'Halloween.","Fröhliches Halloween! Verpasse das Halloween-Wochenende über deinen Zauberfabriken für nur jeweils EIN JUWEL einen Schub.","¡Feliz Halloween! Acelera el caldero de hechizos por una gema durante el fin de semana de Halloween.","Felice Halloween! Accelera le fabbriche degli incantesimi, usando UNA GEMMA ciascuna, durante il weekend di Halloween.","Fijne Halloween! Geef tijdens het halloweenweekend je spreukenfabrieken een boost voor maar ÉÉN EDELSTEEN per stuk.","God halloween! Forsterk magifabrikkene for bare ÉN JUVEL per fabrikk i halloween-helgen.","Tenha um ótimo Halloween! Acelere suas fábricas de feitiços por UMA GEMA cada, durante o final de semana do Halloween.","Cadılar Bayramı Kutlu Olsun! Cadılar Bayramı hafta sonu boyunca her bir Büyü Fabrikasını BİR TAŞLA destekle.","ハッピーハロウィーン！ハロウィーンの週末は、呪文工場を、1棟につき、たったのエメラルド1個でブーストできます。","万圣节快乐！在万圣节周末，每个法术工厂的加速只需花费一颗宝石。","행복한 할로윈 되세요! 할로윈 주말까지 마법 제작소를 보석 1개로 가속할 수 있습니다.","Веселого Хэллоуина! Только в праздничные выходные прокачай свою фабрику заклинаний всего за ОДИН САМОЦВЕТ!","هالوين سعيد! قم بتعزيز مصانع التعويذات مقابل جوهرة واحدة خلال عطلة نهاية الأسبوع في الهالوين.","萬聖節快樂！在萬聖節活動的週末，為魔咒工廠加速只需花費一顆寶石！"
"TID_EVENT_BOOST_EVERYTHING","Halloween Cauldron","Chaudron d'Halloween","Halloween-Kessel","Caldero de Halloween","Calderone di Halloween","Halloweenketel","Halloween-gryte","Caldeirão do Halloween","Cadılar Bayramı Kazanı","ハロウィーンの大釜","万圣节坩埚","할로윈 가마솥","Хэллоуинский котел","مرجل الهالوين","萬聖節魔法鍋"
"TID_XP_TITLE_UNLOCK_PUZZLEANDDRAGONS","ClashCon live stream!","ClashCon en live !","ClashCon Live-Stream!","¡Emisión en directo del ClashCon!","Diretta in streaming del ClashCon!","Livestream van ClashCon!","ClashCon live stream!","Stream da ClashCon!","ClashCon canlı yayını!","ClashConのライブストリーム！","部落冲突2015国际邀请赛直播！","클래시콘 생중계!","Трансляции ClashCon!","البث المباشر لمؤتمر ClashCon!","部落衝突狂歡節 ClashCon 現場直播！"
"TID_XP_TEXT_UNLOCK_PUZZLEANDDRAGONS","Clan war tournaments, update news and more. Don't miss a minute of ClashCon, this Saturday from 14:00 to 23:00 (UTC)","Tournois de guerre des clans, nouveautés et plus encore. Ne manquez surtout pas ClashCon, samedi prochain de 14h00 à 23h00 (UTC).","Clankrieg-Turniere, Neuigkeiten und mehr. Lass dir diesen Samstag die ClashCon nicht entgehen (14:00 Uhr bis 23:00 Uhr UTC)!","Torneos de guerra de clanes, noticias sobre actualizaciones y mucho más. No te pierdas nu un minuto del ClashCon, este sábado de 14:00 a 23:00 (UTC).","Tornei guerra tra clan, aggiornamenti e tanto altro. Non perdere nemmeno un minuto del ClashCon, sabato dalle 14:00 alle 23:00 (UTC)","Toernooien met clanoorlogen, updatenieuws en meer. Mis geen seconde van ClashCon, aanstaande zaterdag van 14:00 tot 23:00 (UTC).","Klankrig-turneringer, nyheter om oppdateringer og mye mer. Ikke gå glipp av et eneste minutt av ClashCon på lørdag fra kl. 14.00 til 23.00 UTC.","Torneios de guerras de clãs, notícias atualizadas e muito mais. Não perca um minuto da ClashCon, neste sábado, das 14:00 às 23:00 (UTC)","Klan savaşı turnuvaları, güncelleme haberleri ve çok daha fazlası. ClashCon'un bir anını bile kaçırmayın, bu cumartesi 14:00 ile 23:00 arasında (UTC)","クラン対戦トーナメントや新着情報など盛りだくさん。今週土曜日 18時～27時 (日本時間) 開催のClashConをお見逃しなく！","观看部落冲突2015国际邀请赛、追踪最新的游戏更新内容，以及了解部落冲突狂欢节ClashCon的更多精彩内容，敬请关注！直播时间：北京时间本周六（10月24日）17:00至本周日（10月25日）02:00。","대규모 업데이트 소식뿐만 아니라 한국팀이 참가하는 클랜전 토너먼트가 생중계됩니다! 이번 주 토요일 오후 6시 15분(한국 시간)부터 진행되는 클래시콘 생중계를 놓치지 마세요.","Турнир клановых войн, свежие новости и многое другое... Не пропустите ни минуты ClashCon: в эту субботу с 14:00 до 23:00 (UTC).","بطولات حروب القبائل، أخبار التحديثات والمزيد. لا تضيعوا أية لحظة من ClashCon، هذا السبت من الساعة 14:00 وحتى الساعة 23:00 بالتوقيت العالمي UTC","觀看部落衝突2015國際邀請賽、追蹤最新的遊戲更新內容，以及了解部落衝突狂歡節ClashCon的更多精彩內容，敬請關注！直播時間：台北時間本周六（10月24日）17:00至本周日（10月25日）02:00。"
"TID_XP_BUTTON_UNLOCK_PUZZLEANDDRAGONS","More Info","Plus d'infos","Mehr erfahren","Más información","Altre info","Meer info","Mer info","Mais informações","Daha Fazla Bilgi","詳細","直播地址","추가 정보","Подробнее","المزيد من المعلومات","詳細資訊"
"TID_NEWS_UPDATE_INFO_TITLE","Watch ClashCon live!","Regardez ClashCon en live !","ClashCon live mitverfolgen!","¡Ven a ver el ClashCon en directo!","Guarda la diretta del ClashCon!","Kijk live naar ClashCon!","Se ClashCon live!","Assista a ClashCon ao vivo!","ClashCon'u canlı izleyin!","ClashConのライブストリームをご覧ください！","现在观看部落冲突2015国际邀请赛直播！","클래시콘 생중계를 놓치지 마세요!","Следите за ClashCon в прямом эфире!","مشاهدة بث مباشر لمؤتمر ClashCon!","立刻觀賞 部落衝突狂歡節 ClashCon！"
"TID_NEWS_UPDATE_INFO_TEXT","Clan war tournaments, update news and more. Tune in to the ClashCon live stream.","Tournois de guerre des clans, nouveautés et plus encore. Regardez ClashCon en direct.","Clankrieg-Turniere, Neuigkeiten und mehr. Schau dir die ClashCon live im Stream an.","Torneos de guerra de clanes, noticias sobre actualizaciones y mucho más. Ven a ver la emisión en directo del ClashCon.","Tornei guerra tra clan, aggiornamenti e tanto altro. Segui la diretta in streaming del ClashCon.","Toernooien met clanoorlogen, updatenieuws en meer. Stem af op de livestream van ClashCon.","Klankrig-turneringer, nyheter om oppdateringer og mye mer. Få med deg vår ClashCon live stream.","Torneios de guerras de clãs, notícias atualizadas e muito mais. Acompanhe o stream da ClashCon.","Klan savaşı turnuvaları, güncelleme haberleri ve çok daha fazlası. ClashCon canlı yayınını takip edin.","クラン対戦トーナメントや新着情報など盛りだくさん。ClashConのライブストリームをぜひご覧ください。","赶快点击直播按钮，观看部落冲突2015国际邀请赛，第一时间获取最新的游戏更新内容，以及了解部落冲突狂欢节ClashCon的更多精彩内容！","대규모 업데이트 소식뿐만 아니라 한국팀이 참가하는 클랜전 토너먼트가 생중계됩니다!","Турнир клановых войн, свежие новости и многое другое... Смотрите прямые трансляции ClashCon.","بطولات حروب القبائل، أخبار التحديثات والمزيد. تابعوا البث المباشر لمؤتمر ClashCon.","趕快點擊直播按鈕，觀看部落衝突2015國際邀請賽，第一時間獲取最新的遊戲更新資訊，以及了解部落衝突狂歡節ClashCon的更多精彩內容！"
"TID_NEWS_UPDATE_INFO_TEXT_SHORT","Watch Now","Regarder maintenant","Jetzt ansehen","Ver ahora","Guarda ora","Nu kijken","Se nå","Assistir agora","Hemen İzleyin","今すぐ見る","立刻观看","지금 보기","Смотреть сейчас","مشاهدة الآن","立即觀看"
